{
  "id": "wave-striker-chain-rush",
  "title": "Wave Striker — Chain Rush",
  "subtitle": "충격파를 쏘고, 분홍 젬의 2차 파동으로 연쇄를 번지게 한다.",
  "status": "prototype",
  "entry": "index.html",
  "aiAssisted": true,
  "credits": "AI 생성 도구를 활용해 제작했습니다. 콘셉트·연출·선별: aamemoho.",
  "published": true,
  "capabilities": [],
  "vendorHashes": {
    "game.js": "5011fe230337a22e06a677eaa595ce9566f5e0cd9ebf1864217634ad43e3aa2a"
  },
  "accent": "#5ce1ff",
  "order": 50
}
