{
  "id": "crt-2026-0725-a",
  "title": "목적지 없는 길목",
  "subtitle": "선택이 유리 카트리지의 물성과 내부 반응을 바꾼다.",
  "status": "prototype",
  "entry": "index.html",
  "aiAssisted": true,
  "credits": "AI 생성 도구를 활용해 제작했습니다. 콘셉트·연출·선별·편집: aamemoho.",
  "published": true,
  "capabilities": ["parent-bridge"],
  "vendorHashes": {
    "vendor/three-r128.min.js": "9274bbcec8d96168626c732b5d31c775aa8cfb7eaa0599bec0c175908a2c1ce2"
  },
  "accent": "#00d9f4",
  "order": 10
}
